question,image,choice1,choice2,choice3,choice4,bloque
Cal será o valor óptimo para a resistencia que protexe aos LED?,images/analog-findR-2led-6V2V10ma.png,200 Ω,non fai falla resistencia,"0,2 Ω",400 Ω,electronica_analoxica
Cal será o valor óptimo para a resistencia que protexe aos LED?,images/analog-findR-2led-6V3V10mA.png,non fai falla resistencia,300 Ω,600 Ω,100  Ω,electronica_analoxica
Que problema presentará este circuíto?,images/analog-led-differentCurrent.png,Non é recomendable mesturar leds que precisan diferentes intensidades,Non é recomendable mesturar leds que precisan diferentes voltaxes,A resistencia é demasiado pequena,Os leds terían que ir en paralelo,electronica_analoxica
Cal é a principal función dos condensadores?,,Almacenar carga eléctrica,Xenerar corrente eléctrica,Aumentar a duración dunha pila,Almacenar capacidade de corrente eléctrica,electronica_analoxica
Cales son os tipos principais de condensadores?,,Polarizados e non polarizados,Electrolíticos e polarizados,Cerámicos e non polarizados,Cerámicos e electrolíticos,electronica_analoxica
Cales son os condensadores polarizados máis comúns?,,Electrolíticos,Cerámicos,De poliéster,Dieléctricos,electronica_analoxica
Cales son os condensadores non polarizados máis comúns?,,Cerámicos,Electrolíticos,Dieléctricos,Capacitores,electronica_analoxica
Que compoñente é este?,images/analog-capacitor-electrolitic-pic.jpg,Un condensador electrolítico,Un condensador cerámico,Un díodo,Un transistor,electronica_analoxica
Que quere dicir que un condensador teña escrito - 16V- sobre el?,,Que soportará un máximo de 16V de tensión,Que precisa un mínimo de 16 V para funcionar,Que o funcionamento óptimo se dá a 16 V,"Que, en condicións normais, proporcionará 16V",electronica_analoxica
Cal é a unidade na que se mide a capacidade dun condensador?,,Faradios,microFaradios,picoFaradios,Todas son correctas,electronica_analoxica
Cal é a unidade na que se mide a capacidade dun condensador?,,Faradios e os seus múltiplos,Henrios e os seus múltiplos,Cosmios e os seus múltiplos,Hertzios e os seus múltiplos,electronica_analoxica
Como se chama o material que separa as dúas capas dun condensador?,,Dieléctrico,Eléctrico,Faradio,Semicondutor,electronica_analoxica
Cal condensador tardará máis en descargarse?,images/analog-capacitors-timeDischargeR.png,O do circuíto -d-,O do circuíto -a-,O do circuíto -b-,O do circuíto -c-,electronica_analoxica
Cal condensador tardará menos en descargarse?,images/analog-capacitor-timeDischargeC.png,O do circuíto -d-,O do circuíto -a-,O do circuíto -b-,O do circuíto -c-,electronica_analoxica
Cal condensador tardará máis en descargarse?,images/analog-capacitor-timeDischargeCR.png,O do circuíto -c-,O do circuíto -a-,O do circuíto -b-,O do circuíto -d-,electronica_analoxica
Cal é a capacidade total deste circuíto?,images/analog-capacitors-parallel.png,10 uF,6 uF,"2,4 uF",24 uF,electronica_analoxica
